{
  "id": "inverse_square_law_short_distance",
  "name": "Newtonian inverse-square law down to ~50 micrometers",
  "kind": "precision_test",
  "requirement": "Any candidate framework that introduces extra spatial dimensions or new long-range forces must respect laboratory tests of the gravitational inverse-square law at sub-millimeter distances. Yukawa-type deviations of the form V(r) = -G m1 m2/r [1 + alpha exp(-r/lambda)] are excluded for alpha ~ 1 down to lambda ~ 52 micrometers.",
  "regime": {
    "length_m": 5e-5,
    "energy_ev": null,
    "description": "Sub-millimeter to ~10 micrometer separations between rotating tungsten test masses; torsion-balance and microcantilever experiments."
  },
  "current_bound": {
    "value": "alpha < 1 for lambda > 52 micrometers",
    "uncertainty": null,
    "units": "Yukawa amplitude alpha (dimensionless), range lambda (length)",
    "experiment": "Eot-Wash torsion-balance group (Univ. of Washington)",
    "year": 2020,
    "reference": "Lee et al., 'New Test of the Gravitational 1/r^2 Law at Separations down to 52 micrometers', PRL 124, 101101 (2020), arXiv:2002.11761",
    "confidence_level": "95% CL"
  },
  "what_it_excludes": "Large-extra-dimension scenarios (ADD-style) with two extra dimensions are excluded down to compactification radii below ~30 micrometers, ruling out the original 'gravity becomes strong at the TeV scale via mm-sized extra dimensions' proposals. Forbids generic moduli or radion fields with gravitational-strength couplings and ranges above ~50 micrometers.",
  "procedural": {
    "parameterization": {
      "name": "Yukawa parameterization of the gravitational potential. Long-distance modifications use a slightly different fit but the same (alpha, lambda) structure.",
      "reference": "Adelberger, Heckel, Nelson, ARNPS 53, 77 (2003).",
      "summary": "V(r) = -G m_1 m_2 / r [1 + alpha * exp(-r / lambda)]. The (alpha, lambda) plane summarizes lab tests of gravity at sub-mm to ~10 m scales. Excludes both extra dimensions (large alpha at sub-mm lambda) and light moduli (smaller alpha at meter-scale lambda)."
    },
    "predicted_observable": "Force between two test masses at separation r, computed in the framework. Subtract Newtonian, fit residual to Yukawa form to extract (alpha, lambda).",
    "bound_in_parameterization": "alpha < 1 for lambda > 52 micrometers (Eot-Wash 2020). Tighter bounds at larger lambda: alpha < 10^-4 at lambda ~ 1 cm; alpha < 10^-9 at lambda ~ 1 AU (planetary ephemerides).",
    "framework_inputs": [
      "Predict the gravitational potential between two static masses as a function of separation, including all new-field contributions.",
      "Identify the dominant non-Newtonian contribution and fit it to Yukawa form to read off (alpha, lambda)."
    ],
    "evaluator_status": "trivial",
    "notes": "ADD-style large extra dimensions parameterize directly: alpha = 8 N/3, lambda = R_compactification, where N is the number of extra dimensions. Fitting against the Eot-Wash exclusion plot is one of the cleanest tests for any framework with new long-range forces."
  },
  "primary_references": [
    {
      "citation": "Lee et al. (Eot-Wash), 'New Test of the Gravitational 1/r^2 Law at Separations down to 52 micrometers', PRL 124, 101101 (2020)",
      "arxiv": "2002.11761"
    },
    {
      "citation": "Adelberger, Heckel, Nelson, 'Tests of the Gravitational Inverse-Square Law', Annu. Rev. Nucl. Part. Sci. 53, 77 (2003)",
      "doi": "10.1146/annurev.nucl.53.041002.110503"
    }
  ],
  "tags": ["gravity", "extra_dimensions", "fifth_force", "short_distance"]
}
